journal,summary,anger,disgust,fear,joy,neutral,sadness,surprise
"Dear Journal,
It feels almost surreal to be writing this. Six months. Six whole months with Liam. Sometimes I still catch myself smiling like an idiot when his name pops up on my phone, or when I just *think* about him. Is this what love feels like? It’s not just the butterflies anymore, though they still make an appearance when he looks at me *that way*. It’s…deeper now. It’s a quiet certainty, a comforting warmth that settles in my chest.
We had our six-month anniversary dinner last night. Nothing fancy, just that little Italian place we stumbled upon back in May, the one with the checkered tablecloths and the surprisingly good gnocchi. He brought me a single sunflower, my favourite. He always remembers the little things. We talked for hours, tracing the journey from our awkward first date – remember how I spilled water all over myself? – to now. We laughed about it, but there was also this undercurrent of…gratitude? Like, wow, we actually made it here. We’re *here*.
He told me he loves my laugh, especially when it’s genuine and I’m not trying to stifle it. He said it’s like music. And I, in turn, told him I love how he always finds a way to make me feel safe, even when the world feels chaotic. It’s not just big gestures with Liam; it’s the way he holds my hand without even thinking about it, or the way he listens, really listens, without interrupting, even when I’m rambling about my latest existential crisis over my English Lit essay.
Today, we just spent the afternoon at his place, listening to vinyl records. He put on some old jazz, something I’d never really listened to before, and just watched me, smiling. We didn’t even talk much. Just existing in the same space, feeling completely comfortable. It’s a new kind of intimacy for me, this quiet shared space. Before Liam, I always felt like I had to be ""on,"" performing some version of myself. With him, I can just *be*. I can be messy, I can be tired, I can be unsure, and he just…accepts it. He sees it, acknowledges it, and still looks at me like I’m the most fascinating person in the world.
Sometimes, though, a tiny, almost imperceptible whisper of fear creeps in. This is my first serious relationship. What if I mess it up? What if I’m not good enough? He’s so calm and steady, and I feel like I’m still figuring out who I am, fluctuating between confident and completely clueless. Will he ever get tired of my inconsistencies? I haven't voiced this to him, not yet. It feels too fragile, too much like admitting a weakness. But then he’ll do something small, like remember I like my coffee with just a splash of oat milk, and that little fear will recede, drowned out by the warmth of his presence. It’s a beautiful feeling, this burgeoning love, but it’s also a little terrifying, like standing on the edge of something vast and unknown. But right now, the joy definitely outweighs the trepidation. I just hope I can keep growing into the kind of person who deserves this kind of happiness.","The entry celebrates a six-month anniversary with Liam, marked by a heartfelt dinner, shared laughter and memories, and a peaceful afternoon listening to music, all while reflecting on a deepening love, comfort, and a touch of hopeful trepidation for the future.",0.0001,0.0001,0.12,0.85,0.02,0.0001,0.005
"Date: November 18th
Dear Journal,
Well, the honeymoon phase officially hit its first speed bump. Nothing catastrophic, no dramatic fights, but definitely a noticeable shift in the air. It happened yesterday. I had this huge midterm for my Intro to Philosophy class, and I was completely stressed. Liam offered to come over and study with me, which was sweet, but I really just needed to buckle down and focus, alone. I tried to explain that I needed quiet, uninterrupted time, that having someone else there, even if they were silent, would be a distraction.
He seemed to take it personally. He said, ""I thought you'd want my support."" And I *do* want his support, just not in that specific way at that specific moment. It spiraled a little from there. He got quiet, which is his tell for being upset. I tried to reassure him, telling him it wasn't about *him*, it was about *me* and my study habits. But the more I explained, the more it felt like I was digging myself into a deeper hole. He eventually left, saying he understood, but his eyes told a different story.
I felt awful. Guilty, but also a little frustrated. It’s hard, isn’t it, when your needs don’t perfectly align? My instinct when I’m overwhelmed is to retreat and process alone. His, I’m learning, is to be close and offer comfort. Neither is wrong, but they clashed yesterday. After the midterm today (which, by the way, I think I aced, thanks to that uninterrupted focus), I called him. It was a tense conversation at first. He admitted he felt a bit rejected, like I was pushing him away.
I had to really dig deep and explain that it wasn't about him, but about my own need for solitude when I'm under pressure. I told him it’s how I recharge and how I best handle stress, and that it has nothing to do with how much I value him or his presence. I also admitted that I’m still learning how to articulate my needs without making others feel unwanted. He listened, and after a moment, he said, “Okay. I get it. It’s just…different for me. I guess I need to learn your signals better.”
We talked for a good hour, dissecting the misunderstanding. It wasn’t fun, but it felt necessary. We’re still learning each other’s operating manuals, I guess. It made me realize how much of a partnership a relationship really is, and how much communication is required, even when it’s uncomfortable. It’s not just about the good times and the easy connections; it’s also about navigating these little bumps and figuring out how to respect each other’s individual spaces and processes. I'm learning that my personal growth isn't just about my solo journey, but also about how I integrate my evolving self into the dynamics of a relationship. It's challenging, but I think we came out of it stronger, with a deeper understanding of how we both function. I hope this means fewer misinterpretations in the future, but I also know it's probably just the first of many.","A relationship's first 'speed bump' occurred when the diarist's need for solitary study clashed with Liam's offer of support, leading to initial guilt and tension. After successfully completing her midterm, they navigated a difficult but ultimately strengthening conversation, deepening their understanding of each other's needs and communication styles.",0.0652173913,0.0,0.0108695652,0.2173913043,0.4891304348,0.2065217391,0.0108695652
"**Date: December 10th**
Dear Journal,
Liam and I had such a lovely day today. We went to that little bookstore downtown, the one with the creaky floors and the smell of old paper. We spent hours just browsing, occasionally pointing out books to each other, reading passages aloud. He found a first edition of a sci-fi novel he’d been looking for, and his face lit up like a kid on Christmas morning. It’s moments like those, seeing him genuinely happy and engrossed in something he loves, that make my heart swell.
Later, we ended up at our favourite coffee shop, tucked away in a corner booth, just talking. The conversation drifted to the holidays, and then, surprisingly, to the future. Not like, ""where do you see yourself in five years?"" kind of future, but more like, ""what do you imagine our Christmases looking like down the line?"" And then, even further, ""what kind of house would you want? Do you see yourself living in the city or somewhere quieter?""
It felt so natural, so easy, to talk about these hypothetical futures with him. He talked about wanting a big kitchen because he loves to cook, and I talked about wanting a window seat for reading. We even jokingly debated the merits of a dog versus a cat. It wasn’t a proposal or anything serious, but just the ease with which we could envision a shared life, even a distant one, felt incredibly comforting. It solidified something in my mind: he’s not just here for now; he’s someone I can genuinely imagine a long-term future with. That’s a revelation for me. I’ve always been so focused on my immediate future – getting through college, figuring out a career. To have someone else woven into that tapestry, someone who makes the future seem less daunting and more exciting, is a profound feeling.
Yet, despite all this warmth and connection, I had a moment of intense insecurity last night. We were getting ready for bed, and I was just looking at him, so comfortable and secure in himself. And I suddenly felt…less than. He’s so smart, so steady, so kind. And sometimes I worry I’m not enough for him. Am I interesting enough? Am I mature enough? Do I bring enough to the table? It’s this persistent little voice in the back of my head that whispers, “He could do better.”
I know it’s irrational, a leftover from past insecurities. He constantly reassures me, tells me how much he loves me, how much he values me. But those whispers are tenacious. I didn’t say anything to him; it felt too vulnerable to admit such a self-deprecating thought. I just curled into him and tried to push it away. It’s a strange dichotomy: feeling so incredibly loved and yet still battling these internal doubts. This relationship is making me confront so many aspects of myself, not just the positive ones. It's forcing me to address the parts of me that still struggle with self-worth, even when I'm being shown so much worth. It’s a journey, this personal growth thing, and it doesn't stop just because you've found someone amazing. In fact, it often intensifies.","A day of heartwarming connection with Liam, envisioning a shared future and solidifying a deep bond, was contrasted by an internal struggle with persistent self-worth insecurities, highlighting the complex journey of personal growth within a loving relationship.",0.0,0.0,0.08,0.75,0.01,0.15,0.005
"Date: January 25th
Dear Journal,
Well, we had our first real disagreement that wasn't just a misunderstanding of needs. This one felt more significant, more rooted in our different perspectives. It was about my friend Sarah. She’s going through a tough time with her family, and I’ve been trying to be there for her as much as possible. Liam made a comment, a seemingly innocent one, about how I was ""always with Sarah"" and that he felt like he was ""competing for my time.""
My immediate reaction was defensiveness. I explained, quite forcefully, that Sarah needed me, and that true friendship meant showing up. I felt like he was being insensitive to her situation and, by extension, to my commitment to my friends. The conversation escalated, voices raised slightly, which is rare for us. I accused him of being selfish, and he accused me of neglecting him. It wasn’t pretty. We ended up just kind of…stopping. The air was thick with unspoken tension.
I spent the rest of the evening stewing. I was angry, but as the anger cooled, a different feeling crept in: remorse. I realized I hadn't truly listened to his underlying feeling. While my focus was on Sarah, his was on us, on feeling a bit neglected. And while my loyalty to Sarah is unwavering, I probably hadn't been as mindful of Liam's needs as I could have been. He wasn’t saying *don’t* help Sarah, he was saying *I miss you*.
This morning, I went over to his place, a bit nervous. I started by apologizing, not for helping Sarah, but for the way I reacted and for dismissing his feelings. I said, ""I'm sorry I snapped at you last night. I hear that you feel like I haven't been prioritizing our time together, and I understand why you'd feel that way. Sarah's situation is tough, but it doesn't mean I can't still make time for us, and I want to. I got defensive, and I shouldn't have.""
He looked surprised, and then a little relieved. He then apologized too, for making me feel guilty about being a good friend, admitting he was probably feeling a bit insecure and lonely himself. We talked it through, really talked. We came up with a plan to schedule specific ""us"" time each week, even if it's just a couple of hours for a movie night or a walk, to ensure we both feel connected and prioritized.
It was a tough conversation, but it taught me so much about the importance of genuine apologies and looking beyond the immediate conflict to the underlying emotions. It’s not about who’s ""right"" or ""wrong."" It’s about understanding each other’s perspectives and finding a way to meet in the middle. This relationship is constantly pushing me to communicate better, to be more empathetic, and to take responsibility for my part in disagreements. It's uncomfortable sometimes, but it’s making me a better person, not just a better partner. It's a reminder that personal growth often happens in the messy middle of conflict and resolution.","After a tense argument fueled by defensiveness and unmet needs, the journal recounts a morning reconciliation where genuine apologies led to mutual understanding and a plan for dedicated couple time, transforming conflict into a catalyst for personal growth.",0.05,0.001,0.01,0.38,0.35,0.15,0.005
"Dear Journal,
It’s crazy to think it’s been almost a year since Liam and I started dating. We celebrated our official one-year anniversary last night, back at the Italian place, of course. It felt different this time, not just exciting and new, but deeply rooted and comfortable. We didn’t need to fill every silence; the silence itself was a comfort.
He gave me a beautiful, small silver necklace with a tiny, delicate ""L"" charm. It's simple, elegant, and perfectly ""us."" I got him a custom-made leather-bound journal, knowing how much he loves to write down his ideas. We talked about how much we’ve both grown in the past year, individually and together. He said I’ve become more confident in voicing my needs, and I told him he’s become more open about his feelings, even the difficult ones.
I reflected on that conversation about Sarah, and how difficult it was at the time. Now, it feels like a distant memory, a hurdle we cleared that ultimately made us stronger. We've had a few more smaller bumps since then, but each time, we've approached them with more patience and understanding, learning from our past missteps. It’s not perfect, but it feels like a really strong foundation.
What I’m appreciating most now isn’t just the big romantic gestures or the exciting dates, but the fabric of our everyday life. It’s the way he leaves me a little handwritten note on the fridge before he leaves for work, or the way we cook dinner together, inevitably ending up in a laughing mess. It’s the way he encourages me when I’m feeling overwhelmed by my studies, or how he’s genuinely interested in my passions, even the ones he doesn't fully understand.
This relationship has forced me to look inwards more than I ever have before. It’s taught me about compromise, about vulnerability, about the power of a sincere apology. It's shown me how much strength there is in admitting you're wrong, and how much love there is in accepting someone else's flaws. I’m still learning, still growing, but I feel like I’m doing it alongside someone who truly sees me, values me, and pushes me to be better.
Being in a relationship isn’t just about finding your person; it's about finding more of yourself through that connection. It’s about learning to balance your individual identity with a shared one. It’s messy and beautiful and challenging, and right now, I wouldn't trade it for anything. I feel loved, secure, and excited for whatever comes next. This first serious relationship has been an incredible journey of discovery, both of Liam and of myself.","This entry reflects on a significant one-year anniversary with Liam, highlighting the evolving comfort, mutual growth, and deep appreciation for both the grand gestures and the everyday fabric of their supportive and loving relationship.",0.0012345678,0.0011111111,0.001,0.957654321,0.025,0.007,0.006
"Today was… surprisingly good? Maybe it’s the slightly cooler weather, or maybe it’s the fact that I actually got more than five hours of sleep last night. Whatever it was, I woke up feeling a little less like a zombie and a little more like a functional human being. My 7:00 AM alarm still felt like a cruel joke, but at least I didn’t hit snooze five times.
My morning class, Principles of Marketing, was actually engaging today. Professor Thompson brought in a guest speaker – a woman who started her own sustainable fashion brand right after graduating. She talked about the struggles of getting started, the importance of networking, and how to stay true to your values in a competitive market. Her passion was infectious. For the first time in a while, I felt a spark of genuine interest, a flicker of something beyond just getting through the day. She talked about using social media not just for promotion, but for building a community, for telling a story. It made me think about my own vague aspirations, the little ideas I scribble down in the margins of my notebooks. Could I actually do something like that? It felt… possible, for a fleeting moment.
The Daily Grind was busy, but manageable. Maybe it was my slightly better mood, or maybe the customers were just collectively in a better mood too. I actually had a couple of pleasant interactions. One elderly woman, Mrs. Gable, who always orders a decaf latte with extra foam, asked me about my studies. When I mentioned I was majoring in business, she nodded sagely and said, “Good for you, dear. It’s hard work, but it’ll pay off.” Her words, though simple, felt like a warm hug. It’s moments like those, the small human connections, that make the endless grind a little more bearable. There was also a moment where a new barista, Chloe, was struggling with the espresso machine during the lunch rush. Shots were pulling too fast, too thin. I remembered the exact adjustment for the grinder that always fixed it and walked her through it, explaining the science behind why the grind size matters. Seeing her relief, and getting a genuine “thank you” felt good. It was a reminder that even in a seemingly simple job, there are opportunities to learn, to teach, and to feel competent.
Later in the afternoon, during a lull, Liam, my roommate, popped in. He was on his way to an engineering lab, but he stopped for a coffee. “You look… less dead today,” he joked, grinning. We chatted for a few minutes about our respective classes. He was struggling with a particularly complex calculus problem, and I offered to look at it with him later, even though math is definitely not my strong suit. But sometimes just talking it through, bouncing ideas off someone else, can help. He then said something that really stuck with me. “You know, I see how hard you work. Don’t ever think it’s not making a difference.” It was such an unexpected compliment, and it hit me right in the chest. We don't often talk about the emotional toll of our schedules, but Liam gets it. He really does. He works just as hard, if not harder, than I do, and seeing him acknowledge my efforts felt incredibly validating.
After my shift, I didn’t feel that usual soul-crushing exhaustion. Instead, I felt a sense of quiet accomplishment. I even managed to tackle some of that history paper research that’s been looming over me. I found a few really interesting primary sources that shed new light on the topic. It felt good to be engaged, to be genuinely curious about something again. Maybe it’s not just about getting through the day, but about finding those small moments of connection, of learning, of feeling competent. Maybe there’s a flicker of light at the end of this tunnel after all. It’s still a long tunnel, but at least today, I could see it.","The day unfolded with a surprising shift from zombie-like exhaustion to genuine engagement, as an inspiring guest speaker ignited a spark of ambition and small human connections at work brought validation and a sense of competence. The unexpected positivity culminated in feeling a quiet accomplishment and a renewed sense of hope, making the usual grind seem less daunting.",1e-10,1e-10,1e-10,0.9056789123,0.015,0.005,0.0701234567
"Finals are looming like a dark, thunderous cloud on the horizon, and I feel like I’m constantly walking through a swamp, trying to make progress but feeling bogged down by every step. The exhaustion has reached a new level. It’s not just physical anymore; it’s mental, a deep-seated weariness that seeps into every thought.
My morning started with a desperate attempt to cram for my Macroeconomics final. I was in the library at 7:00 AM, surrounded by other equally stressed-out students, all hunched over textbooks, muttering to themselves. I kept rereading the same paragraph about aggregate demand and supply, but the words just bounced off my brain. My mind felt like a sieve, unable to hold onto any new information. Every time I thought I grasped a concept, it would slip away. The pressure is immense. There’s so much riding on these grades, on proving that all this sacrifice, all these late nights, are worth it. But what if they’re not? What if I’m just not smart enough, or disciplined enough, to keep up?
My shift at The Daily Grind was particularly brutal today. It felt like everyone in the city decided they needed their caffeine fix at the exact same moment. The line was constant, and the orders were increasingly complex. Someone wanted a “cold brew, extra strong, with two pumps of sugar-free vanilla, a splash of oat milk, shaken, not stirred, with light ice, in a Venti cup, but only filled to the grande line.” I just stared blankly for a second, then forced a smile and tried to translate that into action. My hands were shaking a little from the sheer volume of work, and my brain felt fried.
During one particularly chaotic moment, I accidentally spilled a full hot latte all over the counter. A customer let out an exaggerated sigh of exasperation. I felt my face flush, and a hot wave of shame washed over me. “I am so sorry,” I stammered, grabbing a cloth and trying to mop it up quickly, my hands trembling. My manager, David, who can sometimes be a bit gruff, saw my distress. He just walked over, put a hand on my shoulder, and said, “Hey, it happens. Deep breaths. We’ll get it.” He took over the next few orders, allowing me a moment to clean up and compose myself. It was a small act of kindness, but it kept me from completely losing it. I appreciated it more than he probably knows. He gets it too – the relentless pace, the demands. He’s been there.
Later, Sarah called. I was almost in tears. I confessed how overwhelmed I felt, how useless and stupid I felt for struggling so much, how I doubted if I was even cut out for college, for a ""real"" career. She listened patiently, without judgment. Then she said, “Hey. You’re not alone. I failed a pharmacology quiz last week. Like, royally failed. And I felt the exact same way. It’s okay to struggle. This isn’t easy. And you are *not* stupid. You’re working your ass off, more than most people I know. Don’t you dare forget that.” Her words were a lifeline. She then reminded me about the study group for Macro we had talked about, suggesting we meet up tonight, even if just for an hour to tackle the trickiest concepts together. Just knowing I wasn't alone in this felt like a huge weight had been lifted.
So now I’m back at my desk, textbook open, a lukewarm coffee beside me. I still feel tired, but Sarah’s words, and David’s small gesture, have given me a little boost. I’m going to meet her in twenty minutes. Maybe we can untangle some of this economic jargon together. Maybe two tired brains are better than one. The finish line feels impossibly far away, but at least I know I’m not running this race alone. That, in itself, is something.","Plagued by looming finals, intense exhaustion, and a chaotic coffee shop shift, the day brought the diarist to the brink of despair. However, small acts of kindness from a manager and a friend's supportive words offered a vital lifeline, transforming overwhelming self-doubt into a renewed, shared resolve to face the challenges ahead.",0.0091234567,0.0050703192,0.2501234567,0.2501234567,0.0801234567,0.3854123373,0.0201234567
