journal,summary,anger,disgust,fear,joy,neutral,sadness,surprise
"October 3rd
I conquered the IKEA desk. And by conquered, I mean I only had to re-do one step twice, and I only bruised my thumb once. The instructions were, as expected, a cruel joke, but I persevered. The desk now stands proudly in the corner, a testament to my tenacity and a constant reminder that I am, in fact, capable of following cryptic diagrams. It’s funny how much pride I feel over something so trivial. It’s not just a desk; it’s a symbol of my evolving adult self. I even wiped it down with a damp cloth – a true sign of domesticity!
After my triumphant furniture assembly, I tackled the grocery store. It was… an experience. I’ve always just grabbed whatever looked good, but this time I had a list, a budget, and a vague notion of nutrition. I found myself staring at a wall of spices, completely bewildered. What even *is* smoked paprika? Do I need it? My cart was a haphazard collection of essentials: pasta, canned tomatoes, a pathetic looking head of broccoli, and a single chicken breast. I felt very adult, very responsible. Then I saw the organic kale and almost had a heart attack at the price. I quickly averted my eyes and settled for the cheaper, slightly less vibrant option. Every penny counts.
The cooking experiment was… less triumphant than the desk. My ambitious pasta primavera turned into a soggy, strangely bland concoction. The broccoli was somehow both overcooked and undercooked at the same time. The chicken breast was a grey, unappetizing lump. I blame the lack of seasonings. Or perhaps my complete inability to judge cooking times. I kept hovering over the pan, convinced it was about to burst into flames, then panicking and turning down the heat too much. The end result was something edible, but not enjoyable. I ate it out of a sense of duty, silently vowing to stick to simpler meals for a while. Maybe scrambled eggs. Or just toast. At least I won’t burn the house down with those.
The financial reality of this place is starting to sink in a little deeper. Every purchase feels amplified. That slightly bruised apple for 50 cents? A win. The fancy coffee I almost bought? A definite loss. I’m already thinking about my next paycheck and how much of it will immediately be swallowed by rent and utilities. It’s a constant mental calculation. The freedom of having my own space is incredible, but it comes with this underlying hum of financial anxiety. I keep reminding myself that this is temporary, that I’ll get better at budgeting, that my income will increase. But sometimes, especially after a disappointing attempt at cooking, it feels like a heavy weight.
Tonight, I just sat on my (newly assembled!) couch, nursing a cup of terrible tea, and stared at the empty wall where I plan to put some art. I have a few posters from college, but they feel too… juvenile for this new chapter. I want something that reflects who I am now, or who I’m becoming. Something more mature, more intentional. But art costs money. So for now, it remains a blank canvas, just like my culinary skills. It’s a symbol of what’s yet to come, what I still need to build and acquire. It’s a reminder that this is a journey, not a destination. And even with the bland food and the budgeting worries, there’s an immense sense of satisfaction. This is my journey, and I’m making it up as I go along.","Today involved a proud victory over an IKEA desk, a responsible but bewildering grocery store trip, and a disastrous cooking experiment. Despite the underlying hum of financial anxiety and a blank canvas for future aspirations, the day ended with a resilient sense of evolving self and independence.",0.0075,0.005,0.14,0.5555555555,0.08,0.19,0.02
"October 7th
The decorating bug has officially bitten. Hard. I spent an entire afternoon on Pinterest, creating boards with names like “Minimalist Sanctuary” and “Boho Chic Haven.” The problem? My budget is more “early-career intern” than “magazine spread.” I want a plush rug, a gallery wall, plants cascading from every surface. What I have is an empty living room and a single, slightly warped poster from a concert five years ago.
I went to a few home goods stores today, just to ""browse."" It was a mistake. Everything looked so perfect, so cohesive, so out of my price range. I touched a velvet throw pillow that cost more than my weekly grocery budget and felt a pang of longing. It’s a strange feeling, this desire to create a beautiful space, but being constantly reminded of financial constraints. It’s not just about aesthetics; it’s about creating a home, a place of comfort and refuge. But how do you achieve that when every lamp feels like a luxury item?
I did manage to find a few small wins. A set of cheap fairy lights at a discount store, which I strung over my window. They cast a surprisingly warm, inviting glow. And a small, surprisingly resilient Pothos plant for five dollars. I’m naming him Kevin. Kevin is currently my most expensive piece of decor, and I’m determined not to kill him. He represents my burgeoning ability to keep something alive besides myself. And he also adds a touch of much-needed green to the otherwise beige palette of my apartment walls.
The cooking situation is slowly improving. I’ve discovered the magic of frozen vegetables and pre-marinated chicken. Not exactly gourmet, but certainly more palatable than my first attempt. Last night, I made a stir-fry that was actually… good. Like, genuinely enjoyable. It wasn't perfect, but it was a step up. I even managed to use a couple of the mystery spices I bought. I’m still battling the urge to order takeout every night. The convenience is so tempting, especially after a long day at work. My old habits are hard to break. I can practically hear the ghostly whispers of pizza delivery drivers outside my door. But I’m holding strong. Most of the time.
The late-night thoughts are starting to settle in. This apartment is so quiet. Sometimes, it’s a comforting quiet, a peaceful silence that allows me to decompress. Other times, it feels vast and empty. I find myself lying in bed, listening to the creaks and groans of the building, the distant sirens, the rhythmic hum of my refrigerator. It’s a different kind of loneliness than being surrounded by people but feeling alone. This is an active, chosen solitude. And while I crave independence, sometimes I miss the easy camaraderie of roommates, the background noise of other lives.
I’m learning so much about myself in this space. I’m learning how messy I truly am, how many dishes I can accumulate before I break down and wash them. I’m learning that I actually like the smell of fresh laundry, and that a clean floor can significantly improve my mood. I’m also learning the true meaning of financial responsibility. Every decision, from a new bath mat to a carton of eggs, has a direct impact on my bank account. It’s a constant balancing act, a tightrope walk between wants and needs. But even with the struggles, the pride in this place is growing stronger every day. It’s not perfect, but it’s mine. And I’m slowly, imperfectly, making it a home.","Driven by a desire to create a beautiful home, the author navigated budget constraints while finding small decorating joys and improving cooking skills. Despite moments of loneliness, they are embracing financial responsibility and slowly transforming their apartment into a cherished personal sanctuary.",0.0312345678,0.0,0.0212345678,0.4578912345,0.2012345678,0.253456789,0.0312345678
"October 12th
I had my first official ""housewarming party"" last night. It was just me. And a bottle of surprisingly decent cheap wine. I put on a ridiculous playlist of all my favorite cheesy 80s songs, lit my new fairy lights, and danced around my living room like no one was watching. Because no one was. And it was glorious. It was a moment of pure, unadulterated joy in my own space. No pressure to entertain, no awkward small talk, just me, my terrible singing, and the quiet satisfaction of being exactly where I wanted to be.
I also finally tackled the dreaded “living room blank wall.” Instead of buying expensive art, I decided to go a more personal route. I printed out some of my favorite photos from my phone – landscapes from past trips, silly selfies with friends, a few candid shots of my family. I bought a cheap pack of clear thumbtacks and created a mini-gallery wall. It's not Pinterest-perfect, but it’s meaningful. It tells a story. My story. And it makes the space feel infinitely more like *me*. It's a reminder that decorating doesn't have to be expensive to be impactful. Sometimes, the most personal touches are the most valuable.
Financially, I'm feeling a little less stressed. I’ve started tracking every single expense, and it’s surprisingly empowering. Seeing where my money goes makes me more conscious of my spending habits. I’ve cut down significantly on impulse buys, and I’m actually starting to enjoy the challenge of finding good deals. I even managed to save a little bit this week, which felt like a huge victory. It’s a small amount, but it’s a start. It gives me a buffer, a sense of control that I didn’t have before. The constant hum of financial anxiety is still there, but it’s quieter now, more of a gentle reminder than a jarring alarm.
My cooking skills are officially leveling up. I successfully roasted vegetables! Perfectly crispy on the outside, tender on the inside. It’s the little things, truly. I’m still not a master chef, but I’m no longer afraid of setting off the smoke detector. I’ve also discovered the joy of batch cooking. Making a big pot of soup on Sunday means lunches for the week, which saves money and prevents me from succumbing to the allure of the expensive cafe sandwich. It’s another small victory, another piece of the independence puzzle falling into place.
The late-night thoughts are still there, but they’ve shifted. Instead of focusing on the quiet, I’m thinking about the possibilities. What will I cook next? What book will I read on my couch? How will I continue to make this space feel more like home? I’m starting to embrace the solitude, to see it as an opportunity for introspection and growth. This apartment isn’t just a place to sleep; it’s a laboratory for my life. I’m experimenting with habits, with routines, with my own identity.
There’s a deep sense of satisfaction that comes with knowing I’m building this life for myself, brick by brick, budget dollar by budget dollar. It’s hard work, and there are still moments of doubt and frustration. But then I look around at my little living room, with its fairy lights and its personal photo gallery, and I remember why I did this. This is freedom. This is growth. This is my own little corner of the world, and it’s getting better every day.","The author celebrated newfound independence and a deep sense of self by transforming their apartment into a personal sanctuary through joyful solo dancing, meaningful DIY decor, empowering financial management, and culinary triumphs.",1e-10,1e-10,0.005,0.88,0.05,0.03,0.01
"October 18th
It’s been almost three weeks now, and this place truly feels like home. Not just an apartment, but *home*. The air mattress is long gone, replaced by my proper bed, which, while still needing a headboard, is infinitely more comfortable. My clothes are (mostly) unpacked, my books are on their cheap IKEA shelves, and my Pothos, Kevin, is thriving. He even put out a new leaf!
I finally bought a small, inexpensive rug for the living room. It's not the plush, luxurious one from my Pinterest board, but it adds a much-needed touch of warmth and defines the space. It's funny how a single item can make such a difference. The apartment is far from perfectly decorated – there are still bare walls, mismatched furniture, and a general air of ""work in progress."" But I’ve come to appreciate its imperfections. They tell the story of a young person building a life, one thoughtful (and often budgeted) decision at a time. It’s authentic, and that feels more important than perfection.
My cooking has reached a new level of confidence. I made chili last night, from scratch, with actual dried beans. It was delicious. Like, genuinely, unironically delicious. I even had leftovers for lunch today. The financial benefits of cooking at home are undeniable, and I’m finding a surprising amount of joy in the process. It’s no longer a chore, but an act of self-care. I’m even considering inviting a friend over for dinner next week. A real dinner party! In my own apartment! The thought is both exciting and slightly terrifying.
The financial stress hasn't completely disappeared, but it's transformed. It's no longer a crippling fear, but a constant awareness. I’m getting better at predicting my expenses, at making smart choices, at finding ways to stretch my money without feeling deprived. I’ve started a small “apartment fund” for future purchases – maybe a real coffee maker, or that fancy throw pillow I still secretly covet. It's a long-term game, and I'm slowly but surely winning. The pride I feel in my financial independence is growing alongside my comfort in this space.
The late-night thoughts now are almost entirely positive. I lie in bed, listen to the quiet, and think about all the amazing things I’ve accomplished in just a few weeks. I built furniture, cooked edible (and even delicious!) meals, managed my finances, and created a space that feels uniquely mine. I’ve grown so much, faced so many small challenges, and overcome them.
This apartment isn't just four walls and a roof; it's a testament to my resilience, my burgeoning independence, and my ability to create a life I love. It’s where I decompress after a long day, where I work towards my goals, and where I can truly just be myself. It’s not always easy, and there are still moments when I miss the comfort of my childhood home. But those moments are fleeting. The overwhelming feeling is one of profound gratitude and fierce pride. This is my home, sweet imperfect home, and the future, though still being written, feels incredibly bright. And definitely budgeted.","The narrator reflects on transforming a new apartment into a deeply personal home, marked by newfound comfort, culinary confidence, and financial acumen. This journey has fostered immense pride and optimism, solidifying a sense of independence and a bright, self-created future.",0.0,0.0,0.005,0.9,0.06,0.005,0.025
"October 17th, 2023
Another 1 AM departure from the office. My Uber driver probably thinks I live here. My eyes are gritty, and my shoulders ache, but there’s a strange hum of satisfaction buzzing beneath the exhaustion. Today was… a day. We officially closed the deal with Zenith Corp. *The* Zenith Corp. I still can’t quite believe it. I mean, sure, it was a team effort, a monumental one, but I led the negotiations on our end for the last three months. Three months of late nights, skipped lunches, and weekends blurring into weekdays. I remember staring at that initial proposal, feeling a wave of inadequacy wash over me. I’m 25. What do I know about multi-million dollar contracts? But then Sarah, my mentor, pulled me aside. “You’re here for a reason, Alex,” she’d said, her voice firm but kind. “Now go prove it.”
And I think I did. The moment old Mr. Henderson from Zenith shook my hand, his eyes twinkling, and said, “Well done, young lady. You drive a hard bargain,” I felt something surge through me. Not just pride, though there was plenty of that, but a dizzying sense of accomplishment. This isn’t just about numbers on a screen; it’s about tangible impact. It’s about seeing the strategic vision come to life. And it’s about proving to myself that I can do this. The pressure has been immense. My social life has pretty much evaporated. My plant collection at home is probably plotting its revenge for my neglect. I haven’t seen my best friend, Chloe, in person for weeks, just quick texts and a few hurried phone calls. Even my weekly call with Mom has been shortened to “I’m alive, I’m busy, I love you.” There’s a quiet guilt that gnaws at me sometimes, especially when I see pictures of my friends out having fun, living what seems like a more balanced life. Are they judging me? Am I missing out?
But then I think about the presentation I gave yesterday. I was nervous, my hands trembled slightly as I clicked through the slides, but once I started talking, it was like the words flowed effortlessly. I could see the understanding dawning on their faces, the nods of agreement. That feeling, that connection, it’s intoxicating. It’s what drives me. My ambition is a roaring fire inside me, constantly demanding more. I want to learn everything, do everything, be the best. Sleep feels like a luxury I can’t afford right now. Dinner is often a protein bar eaten hunched over my keyboard. I know this isn’t sustainable in the long term, but right now, it feels necessary. This phase, this ascent, feels critical. I’m building something, not just a career, but a foundation for the rest of my life. And for tonight, the Zenith win feels like enough. It’s a powerful balm to my tired mind. I’ll allow myself a brief moment of celebration, maybe a quick ice cream, before I collapse into bed. Tomorrow, it’s onto the next challenge. Always the next challenge.","After months of grueling work culminating in a 1 AM office departure, the author feels a powerful surge of accomplishment and pride from successfully closing a multi-million dollar deal. This milestone validates their ambition and feels like a crucial step in building their career, despite acknowledging the personal sacrifices and exhaustion.",0.005,0.005,0.01,0.78,0.05,0.12,0.02
"November 5th, 2023
I actually made it to the gym today. For 45 glorious minutes. It felt like a small rebellion against the endless march of deadlines and meetings. My body is sore in places I forgot existed, but my mind feels a little clearer. The past week has been a blur of internal politics and the seemingly endless process of onboarding the new junior analysts. I’m officially a team lead now, overseeing a small but growing group. It's a fantastic opportunity, a testament to the trust my superiors are placing in me, but it’s also a whole new layer of responsibility. I'm not just responsible for my own output anymore; I’m responsible for theirs, for their development, for creating a cohesive unit.
There was a moment today, during the morning stand-up, when Sarah (my now-boss, officially!) gave me a knowing look. “Alex, why don’t you walk us through the Q4 projections?” she said, her voice completely neutral. My heart did a little flutter-kick. It wasn’t a request, it was an expectation. And I nailed it. I had spent all weekend (surprise, surprise) dissecting those numbers, anticipating every possible question, building scenarios. Afterwards, one of the new analysts, Leo, came up to me, eyes wide. “How do you know all that?” he asked. I just smiled, a little tiredly. “Experience, Leo. And a lot of coffee.” But inside, I felt a familiar warmth. It’s a different kind of satisfaction than closing a big deal; it’s the satisfaction of empowering others, of sharing knowledge, of seeing someone else start to grasp the complexities.
The sacrifice, though, has been palpable. My social calendar is a wasteland. My friends tried to drag me out last Friday for Chloe’s birthday, but I just couldn’t. I had a critical report due first thing Monday morning, and my mind was buzzing with figures and strategies. I ended up sending a massive bouquet of flowers and a heartfelt text, but I could feel the disappointment radiating through the phone. I hate missing out on those moments. They’re the fabric of my personal life, the anchors that keep me grounded. Sometimes I feel like I’m living in a parallel universe to them. They’re talking about weekend trips and dating app disasters, and I’m dissecting market trends and analyzing competitor strategies.
The other night, I woke up in a cold sweat, convinced I had forgotten to send a crucial email. My heart was pounding. I practically leaped out of bed, grabbed my laptop, and frantically checked my sent folder. Everything was there. It was just stress, bleeding into my sleep. This constant feeling of being ‘on’ is draining. Even when I’m not at the office, my mind is still whirring, thinking about solutions, anticipating problems. My apartment, which used to be my sanctuary, now often feels like just a place to crash. I need to figure out a way to switch off, even for a little while. Maybe I’ll try a meditation app, or force myself to read a physical book instead of staring at screens. The climb is exhilarating, but the air up here is thin, and I need to learn how to breathe.","The diarist navigates the challenges and satisfactions of a new team lead role, successfully presenting crucial projections and finding joy in mentorship, despite the mounting stress and a palpable sacrifice of personal life and well-being.",0.0051234567,0.0049876543,0.2858765432,0.347654321,0.0543210987,0.2467890123,0.0123456789
"December 1st, 2023
I actually took a day off. A whole, glorious, untouched day off. And you know what? The world didn't end. The office didn't burn down. I spent most of it curled up on the couch, watching terrible reality TV and not thinking about spreadsheets or deadlines. It was glorious. My brain felt like it was unwinding for the first time in months. I even managed to FaceTime with my sister for an hour without getting distracted by emails popping up on my phone. She commented on how tired I looked. I just laughed it off, but she's right. The dark circles under my eyes are practically permanent fixtures.
Today was a bit of a milestone. My presentation to the global leadership team on our proposed expansion into the APAC market went incredibly well. I spent weeks preparing for it, practically living and breathing the data. There were moments of sheer panic, of course, where I felt completely out of my depth. These are the people who run the company, who make multi-billion dollar decisions. But when I got up there, the slides clicked into place, the numbers flowed, and my conviction in the plan was absolute. I saw heads nodding, pens scratching notes. Afterwards, Mr. Davies, the Head of International Operations, pulled me aside. ""Alex, that was truly outstanding work. You've clearly put in the effort, and it shows. We'll be moving forward with your recommendations.""
My jaw nearly hit the floor. This isn't just a win; it's a huge step. It means more responsibility, more travel (hello, early morning flights!), but also incredible visibility and the chance to shape a major part of the company’s future. It’s everything I’ve been working towards. The euphoria is immense. It’s the kind of moment that makes all the late nights and missed dinners worth it. I celebrated by ordering way too much pizza and calling Chloe. She actually picked up! We talked for an hour, catching up on everything. It felt good to laugh about silly things, to just be myself, Alex, not ""Alex, the rising star analyst.""
But there’s a quiet hum of fear beneath the joy. The stakes are getting higher. The margin for error is shrinking. I’m starting to feel the weight of expectations, not just my own, but everyone else’s. People are looking at me differently. They're coming to me for advice, for solutions. I feel like I have to be ‘on’ all the time, perfectly composed and knowledgeable. What if I make a mistake? A big one? What if I can’t live up to these expectations? I’m starting to get imposter syndrome in waves. One minute I’m celebrating a huge win, the next I’m questioning if I truly deserve to be here. This rapid ascent is thrilling, but it’s also disorienting. I’m learning at an exponential rate, but sometimes it feels like I’m barely keeping my head above water. I just hope I don’t drown.","After a much-needed day off, the diarist achieved a major professional triumph by successfully presenting an APAC expansion plan, leading to its approval and a significant career advancement. This immense joy is tempered by a growing fear of heightened expectations and imposter syndrome.",0.0005,0.0005,0.395,0.495,0.09,0.01,0.009
