journal,summary,anger,disgust,fear,joy,neutral,sadness,surprise
"October 17th
Dear Diary,
Okay, today was… a lot. In the best possible way, but still, *a lot*. It started with that weird quiet nervousness in the morning, the one where you can practically hear your own heartbeat in the shower. I spent way too long trying to decide between my blue hoodie and the green one – stupid, I know, but it felt like the fate of the universe hinged on it. And then, there she was. Maya. Just by my locker, leaning against the metal with that easy confidence she always has, her dark curls framing her face just so. She was laughing with Liam, and I felt that familiar jolt, like someone had plugged me directly into an electrical socket. It wasn’t even a big laugh, just a little crinkle around her eyes, and suddenly, my palms were sweaty. *Why* do my palms always get sweaty around her? It’s ridiculous.
We had English first, and I swear, Mr. Harrison was droning on about Shakespeare, but all I could focus on was Maya’s hand resting on her chin, her pen twirling idly. I kept trying to catch her eye, but not in a creepy way, just… like, a friendly glance? A knowing look? I don’t even know what I was going for. When the bell finally rang, that chaotic rush of bodies flooded the hallway. It’s always the same – the smell of stale pizza from the cafeteria, the clanging of lockers, the shouts of friends trying to find each other in the crush. I was trying to maneuver my way through, clutching my books, when I felt a tap on my shoulder. It was Liam. “Hey, you coming to the game Friday?” he asked, his voice easy. And then, from behind him, Maya popped her head out. “Yeah, you have to! We’re all going to meet up at the bleachers.”
My heart did that weird flip-flop thing. “Uh, yeah, definitely!” I managed, probably sounding way too enthusiastic. She smiled, and it was like the sun broke through the clouds in the dingy hallway. A real, genuine smile, directed right at me. And then she was gone, swallowed by the crowd with Liam. I just stood there for a second, feeling a little dazed. Then Sarah bumped into me, snapping me back to reality. “You okay? You look like you just saw a ghost.” I just shook my head, a goofy grin probably plastered on my face. Later, during lunch, we were all squished into our usual booth in the corner of the cafeteria. The noise level was insane – clatter of trays, muffled conversations, the loud bursts of laughter. Maya was telling a story about her little brother, and she looked so animated, her hands flying around. I found myself just watching her, completely captivated. It’s not just that she’s pretty; it’s like she glows from the inside. She just makes everything around her feel… brighter. Then she caught me staring and raised an eyebrow, a mischievous glint in her eyes. I immediately looked down at my half-eaten sandwich, feeling my cheeks flush. *Smooth, real smooth.* But then she nudged my arm lightly. “You okay over there, space cadet?” she teased. I just mumbled something about being tired. But really, I was just so acutely aware of her touch, even through my long-sleeved shirt. It was such a small thing, but it sent a shiver down my arm. I spent the rest of the day replaying that moment, the brush of her hand, the sound of her laugh. It’s exhilarating and terrifying all at once. I’m starting to think this feeling isn’t just about friendship anymore.","The day was filled with overwhelming excitement and nervousness for the narrator, whose world revolved around fleeting interactions with their crush, Maya. Every glance and touch from Maya brought an electric jolt, leaving the narrator dazed and replaying moments, realizing their feelings might be more than just friendship.",1e-10,1e-10,0.125,0.785,0.075,1e-10,0.01
"November 5th
Dear Diary,
The air on the soccer field today was crisp, the kind that bites at your cheeks but feels incredibly invigorating. Practice was intense. Coach Miller was yelling his head off, as usual, about “more hustle!” and “wake up, people!” My legs are still burning, but it’s a good kind of ache. What made it even better was seeing Maya on the sidelines. She’s not on the team, but she often comes to watch Liam and some of our other friends who play. She was bundled up in a huge scarf, her breath pluming in the cold air, cheering us on. Every time I ran past the sidelines, I tried to make eye contact, to give her a quick nod or a wave. It felt stupidly important.
After practice, we were all walking off the field, a muddy, sweaty, exhausted mess. The sun was setting, painting the sky in fiery oranges and purples, and the distant hum of traffic was the only sound besides our collective panting. Liam and I were lagging behind, talking about the ridiculous slide tackle I pulled off (or tried to pull off) during the scrimmage. Suddenly, Maya fell in step with us. “You guys were amazing today!” she said, her voice warm. I felt a surge of pride, even though I probably played like a potato for half the game. Liam, ever the natural charmer, immediately started recounting some of the plays. I mostly listened, just happy to be included in their bubble.
Then, out of nowhere, Maya turned to me. “Hey, I was thinking,” she started, and my stomach did a somersault. “You’re pretty good at history, right?” I nodded, trying to appear nonchalant. “Yeah, I guess.” She smiled. “Well, I’m totally lost on this Revolution project. Would you mind… maybe helping me out after school sometime this week? Like, at the library?” My mind immediately went blank. My heart was pounding so hard I thought Liam might be able to hear it. This wasn’t just a casual chat; this was an *invitation*. To spend time alone with her. At the library. My brain started short-circuiting. *What do I say? What if I mess it up? What if I say something stupid?*
“Uh, yeah! Yeah, I can totally do that,” I stammered, probably sounding like a complete idiot. Liam shot me a weird look, probably because I sounded like I’d just won the lottery. Maya just laughed, a soft, melodic sound. “Great! I’ll text you. Thanks so much!” She gave me a quick, friendly pat on the arm, and then she was off, jogging to catch up with some other friends. I stood there, rooted to the spot, feeling the ghost of her touch on my arm. Liam nudged me. “Dude, you look like you just saw a unicorn.” I just grinned, feeling lightheaded. “No, man, just… thinking about history.” He looked at me skeptically but let it go.
The walk home felt different. The crisp air, the vibrant sunset – everything felt sharper, more beautiful. I kept replaying her words, her smile, the way she asked. It wasn’t a big deal, really, just a study session. But for me, it felt like a monumental step. It’s scary, too. What if she realizes I’m just a giant nerd who knows way too much about dusty old books? What if I bore her? What if I say something totally uncool and she regrets asking? My mind is already racing with all the potential pitfalls. But then I think about seeing her face, really seeing it up close, without the hallway chaos or the soccer field distractions. And that nervous excitement takes over again. It’s like standing on the edge of a diving board, knowing you have to jump, and even though it’s terrifying, you also can’t wait to feel the splash.","After an invigorating soccer practice, the narrator's day becomes monumental when their crush, Maya, unexpectedly asks for help with a history project. This invitation sparks an intense mix of elation and profound nervousness about their upcoming one-on-one time.",0.0023456789,0.0023960632,0.187654321,0.6057891234,0.0801234567,0.030456789,0.0912345678
"November 10th
Dear Diary,
The library. It’s usually this quiet, dusty sanctuary of books and hushed whispers, but today, for me, it was like Grand Central Station during rush hour. My heart was pounding the whole time. I got there ten minutes early, just in case, and spent the time awkwardly pretending to browse the non-fiction section, my eyes scanning the titles but my brain completely blank. And then I saw her, walking through the tall bookshelves, a textbook clutched to her chest. She was wearing a soft, oversized sweater, and her hair was pulled back in a messy bun. She looked so… comfortable. And beautiful.
“Hey!” she whispered, a bright smile on her face as she spotted me. “Thanks for doing this.” We found a table near the big windows, where the afternoon sun streamed in, making dust motes dance in the air. We spread out our books and notes, and for a while, it was all about the American Revolution. She was genuinely struggling with some of the concepts, and I found myself getting really into explaining things, breaking down the causes and effects, trying to make it sound interesting. She listened intently, her brow furrowed in concentration, occasionally asking smart questions that made me realize she wasn’t just pretending to listen.
But then, as we were taking a break, she started talking about something else entirely. About her dream of traveling the world, about how she wants to learn to surf, about this little coffee shop she loves downtown. And I just listened, completely absorbed. It wasn’t just about the words; it was about the way her eyes lit up when she talked about something she was passionate about, the way she gestured with her hands, the little crinkle at the corner of her mouth when she was thinking. I found myself revealing things I usually keep pretty guarded – my own weird fascination with astrophysics, a silly dream I have of opening a dog rescue, even a totally embarrassing story from elementary school. And she just listened, really listened, without judgment, sometimes laughing in that genuine way that makes me feel like a million bucks.
There was this one moment where we both reached for the same pen at the exact same time, and our fingers brushed. It was just for a split second, but it felt like an electric current. I pulled my hand back immediately, my face probably bright red, and mumbled an apology. She just smiled, a little blush rising on her own cheeks, and said, “No worries.” But that small, fleeting touch lingered, buzzing on my fingertips. It felt like a secret.
We probably spent more time talking about everything *but* the Revolution, but I didn’t care. The hours flew by. When she finally packed up her bag, the setting sun was casting long shadows across the library floor. “I actually understand this now,” she said, looking genuinely relieved. “You’re a lifesaver. Seriously.” Her gratitude felt so good, a warm glow spreading through my chest. As we walked out, the air was cold and crisp, and the streetlights were just starting to flicker on. “I had fun,” I blurted out, a little awkwardly. She looked at me, her eyes sparkling under the faint light. “Me too. We should do this again sometime. For fun, not just history.”
And just like that, another invitation. I walked home in a daze, the smell of old books and something faintly sweet (maybe her perfume?) clinging to me. I keep replaying the conversation, her laugh, the brief brush of our hands. It felt… easy. Natural. Like we’d known each other forever, even though it was just a few hours. This is so much more than just a crush now. It’s like I’m seeing her, really seeing her, for the first time. And I think, just maybe, she’s seeing a little bit of me too. And that thought is both exhilarating and absolutely terrifying.","The library, initially a nervous setting for a study session, transformed into a space for profound connection, as a brush of hands and shared vulnerabilities blossomed into a mutual understanding. This led to an exhilarating invitation for a future beyond history books, leaving the diarist in a hopeful daze.",0.0,0.0,0.15,0.687654321,0.05,0.01,0.08
"November 22nd
Dear Diary,
Today was the football game, and the energy was absolutely electric. The bleachers were packed, a sea of our school colors – red and black – and the roar of the crowd was deafening every time our team made a good play. The air was cold, but the excitement kept everyone buzzing. Sarah, Liam, Maya, and I found a spot high up in the stands, squished together, sharing a ridiculously overpriced bag of popcorn. Liam was yelling play-by-plays, Sarah was doing her usual over-the-top cheering, and I was just trying to soak it all in.
But mostly, I was focused on Maya. She was laughing so hard at one point, clutching her stomach, that she leaned against me, just for a second, and that brief contact sent a jolt through me. I tried to act casual, of course, but inside, I was melting. We were talking about something silly, a botched play by the opposing team, and her eyes were shining with amusement. She kept nudging me playfully when our team scored, and a few times, our hands brushed as we reached for popcorn. Each time, it felt like a tiny spark, just enough to make my stomach do a little flip.
At halftime, the band came out, and the whole atmosphere changed from chaotic excitement to this strangely beautiful, synchronized spectacle. The lights on the field dimmed, and the music swelled. Maya leaned closer to me, her voice a soft murmur over the band’s melody. “This part always gives me chills,” she said, and I could feel her breath on my ear. I just nodded, completely speechless. Her proximity was overwhelming, in the best possible way. I could smell her shampoo, something fresh and vaguely floral, and it was intoxicating. It was just a small, innocent moment, but it felt incredibly intimate.
Later, as the game was winding down, and the temperature really started to drop, a light drizzle started. People were pulling out their hoods or scrambling for cover. Maya shivered. Without even thinking, I took off my hoodie – the blue one, the one I spent forever deciding on that first day – and held it out to her. “Here,” I said, probably sounding a little gruff, trying to hide how nervous I was. She looked at me, her eyes wide, and a slow smile spread across her face. “Oh, you don’t have to! You’ll be cold.” But she took it, pulling it over her head, and it was slightly too big for her, making her look even more adorable. The sleeves covered her hands, and she looked up at me, snuggled into the fabric. “Thanks,” she whispered, and her smile was so genuine, so full of warmth, that it made my chest ache in a good way.
For the rest of the game, she wore my hoodie. I kept sneaking glances at her, seeing her wrapped in *my* hoodie, and it felt like a declaration, even though it was probably just a kind gesture. It felt like she was wearing a piece of me. The air was getting colder, the drizzle turning into a steady rain, but I barely noticed the chill. All I felt was this incredible warmth radiating from inside me. As we were leaving, packed in the chaotic exodus from the stadium, she pulled off the hoodie. “Here,” she said, her voice a little lower than usual, and for a second, I thought she was going to hand it back. But then she hesitated. “Can I… can I keep it for a little longer? It’s really soft.” My heart soared. “Yeah! Yeah, totally. Keep it as long as you want.” She smiled again, a little shyly this time, and I felt my cheeks flush. It was such a small thing, a borrowed hoodie, but it felt monumental. It felt like a tiny secret shared between us. The rain was cold, but my walk home was filled with a heat that had nothing to do with the weather. It felt like everything was falling into place, slowly but surely. And the thought of her wearing my hoodie, even now, makes me ridiculously happy.","Attending an exhilarating football game, the diarist's focus was entirely on Maya, experiencing thrilling sparks of connection and intimacy. The day culminated in a heartfelt exchange where Maya sweetly asked to keep the diarist's hoodie, leaving the diarist overwhelmed with joy and a profound sense of blossoming romance.",1e-10,1e-10,1e-10,0.9654321,0.004,1e-10,0.03
"December 3rd
Dear Diary,
Today was the school dance, and let me tell you, it was a whole whirlwind of emotions. Getting ready felt like preparing for a military operation. I spent an absurd amount of time staring at my reflection, trying to decide if my hair looked too messy, too stiff, just right. The music was already thumping when we walked into the gym, a pulsing beat that vibrated through the floorboards. The gym, usually so drab and echoey, was transformed with fairy lights and a surprisingly decent DJ setup. People were already dancing, a sweaty, laughing mass of bodies under the strobing lights.
Liam, Sarah, and I met up with Maya near the punch bowl, which was already suspiciously empty. Maya looked absolutely stunning. She was wearing a simple but elegant dress, and her hair was down, shimmering under the lights. My stomach did that familiar flip-flop, but this time, it was mixed with a surge of something bolder, more confident. We started off just hanging out, yelling over the music, trying to make jokes. Then, a slow song came on, one of those cheesy pop ballads that everyone secretly loves. The crowd thinned out a bit, and couples started swaying.
Liam was off somewhere getting more punch, and Sarah had dragged someone else onto the dance floor. It was just me and Maya. The air felt suddenly charged. My palms, of course, were immediately sweaty. “Wanna… dance?” I managed to ask, my voice sounding strangely high-pitched even over the loud music. She looked at me, her eyes glinting in the dim light, and a slow smile spread across her face. “I thought you’d never ask,” she said, and then she took my hand.
It was just a hand, but it felt like holding onto something precious and fragile. We walked onto the dance floor, and I felt incredibly awkward, trying to figure out where to put my other hand. But she just naturally put her hand on my shoulder, and I, hesitantly, put mine on her waist. We started to sway, awkwardly at first, then more in sync with the slow, cheesy beat. I was hyper-aware of everything: the soft fabric of her dress under my fingers, the subtle scent of her perfume, the warmth of her hand in mine. We didn’t say much, just swayed, looking at each other. Her eyes were so warm, and I could feel my face getting hot, but I didn’t care.
Then, mid-song, she leaned her head against my shoulder. Just a gentle, comfortable lean. And that was it. My heart practically exploded in my chest. I felt a surge of pure, unadulterated joy, mixed with a healthy dose of pure terror. *Is this happening? Is this real?* I closed my eyes for a second, just breathing her in, trying to memorize every detail of that moment. It was perfect. We danced through two more slow songs like that, just swaying, her head on my shoulder, my hand resting lightly on her waist.
When the fast songs kicked back in, she pulled away, a little reluctantly, I thought. “That was… nice,” she said, a little breathlessly, and smiled. I just nodded, unable to form coherent words. The rest of the night was a blur of dancing with our friends, laughing, and just being in the moment. But every now and then, I’d catch her eye across the crowded gym, and she’d smile, and that feeling, that deep, exhilarating warmth, would wash over me again.
As the dance was ending and people were starting to filter out, Maya walked with me towards the exit. The music was winding down, and the lights were coming back on, revealing the slightly messy aftermath of the night. “Thanks for tonight,” she said, her voice soft. “I had a really good time.” I managed to say, “Me too. More than good.” She smiled, a shy, sweet smile, and then, almost before I registered it, she leaned in and kissed my cheek. It was quick, a fleeting brush of her lips against my skin, but it felt like fireworks.
I stood there, stunned, watching her walk away with Sarah, disappearing into the chaotic crowd outside the gym. My cheek where she kissed me felt like it was still burning. My heart was pounding, a happy, frantic drumbeat. I walked home in a daze, the cold night air doing nothing to cool the flush on my face. Everything felt different. The stars seemed brighter, the world more vibrant. This wasn’t just a crush anymore. This was… something real. And terrifying. And utterly, completely amazing. I can’t believe it actually happened.","The school dance transformed into a whirlwind of exhilaration as nervous anticipation gave way to a heartfelt slow dance and a thrilling cheek kiss with Maya, leaving the protagonist in a daze of unexpected joy and wonder.",0.0,0.0,0.0754210987,0.8857431201,0.005,0.0,0.0321098765
"October 17th – It happened again today, that fluttery thing in my stomach when Liam looked at me during Chemistry. It’s more than just a crush now, I think. It’s… a sensation. Like my whole body is humming with some quiet, wonderful electricity. We were partners for the lab, and his hand brushed mine when he reached for the pipette. My heart actually skipped a beat. A real, actual skipped beat, like in those corny romance novels I used to mock. And then he smiled, that easy, crinkly smile that reaches his eyes, and I swear the air around us just… changed. It felt thicker, charged.
Later, after school, my phone buzzed. It was him. “Hey, wanna grab coffee sometime this week?” And just like that, the electricity became a full-blown current. My fingers were shaking when I typed back, “Definitely! I’d love to.” Love. Did I just use that word in my head? Maybe it’s too soon, but it feels right. It feels… inevitable. I spent the next two hours staring at my closet, trying to decide what to wear for a casual coffee date that hasn’t even been scheduled yet. Pathetic, I know, but I can’t help it. Every thought is consumed by him. What will we talk about? Will it be awkward? Will he still look at me like that?
The fear is a tiny, persistent hum beneath the surface of all this giddiness. Fear of messing it up, of saying the wrong thing, of him realizing I’m just… me. Just Maya, with my messy hair and my sometimes-too-loud laugh. He’s so cool, so calm, so effortless. I feel like a clumsy, uncoordinated puppy next to him. But then he texts again, “How was your day, chemistry pro?” and a warmth spreads through me, chasing the fear away. He remembers. He called me a chemistry pro. It’s such a small thing, but it feels monumental. Like he sees me, really sees me.
Tonight, we texted until almost midnight. About homework, about our favorite bands, about the ridiculousness of Mrs. Henderson’s pop quizzes. It was easy, natural. Like we’d known each other forever, even though it’s only been a few weeks of this… awareness. He makes me laugh, truly laugh, the kind that makes my stomach hurt. And when he said, “Goodnight, Maya. Sweet dreams,” I felt a blush creep up my neck even though he couldn’t see it. My dreams are definitely going to be sweet tonight. They’re going to be filled with him, and that electric pulse, and the exhilarating possibility of everything that’s just beginning. My stomach still has butterflies, but now they’re doing a joyful, chaotic dance. This is what it feels like, isn’t it? This is the start of something real. And it’s terrifying and beautiful all at once.","Maya's day was charged with a palpable electricity as her heart-stopping crush on Liam took a significant turn with his invitation for coffee. While excitement and anticipation dominated, a tiny hum of fear lingered beneath the surface of this thrilling, potentially budding romance.",0.0,0.0,0.075,0.895,0.005,0.0,0.02
