journal,summary,anger,disgust,fear,joy,neutral,sadness,surprise
"October 12th
Tonight, I finally got to see *the dress*. Not my dress, not yet, but a sample of it, a ghost of its future self. It arrived at the boutique earlier this week, and the call came just before I left work. My stomach did a little flip – the kind that usually accompanies news of a promotion or a surprise trip, but this was different. This was the gentle flutter of a dream finally taking tangible form.
Mom and Aunt Carol were already there when I arrived, their faces alight with a mixture of excitement and the quiet, almost reverent anticipation you see in people before a significant unveiling. Mom, of course, had armed herself with her signature oversized purse, ready for any photographic opportunity, and Carol had a notebook – no doubt filled with opinions and practical advice she’d been saving for weeks. It felt good, seeing them so invested. For so long, the wedding was just a distant hum, a vague aspiration. Now, with the dress, it felt real, almost within reach.
The consultant, a lovely woman named Sarah who exuded a calm professionalism I desperately needed, led us to a private fitting room. And there it was, hanging on a padded hanger, shrouded in a protective bag. Even through the fabric, I could see the silhouette, the subtle shimmer of the lace. My breath hitched a little.
When she finally pulled it out, a soft gasp escaped me. It wasn’t the exact fabric I’d chosen, nor the precise shade of ivory, but the structure, the delicate lacework, the way it flowed… it was all there. I ran my hand over the material, feeling the intricate embroidery, the weight of the train. It was everything I’d envisioned, and more. Mom teared up, of course. “Oh, darling,” she whispered, her voice thick with emotion, “it’s just… perfect.” Aunt Carol, ever the pragmatist, chimed in, “It’s very elegant, Clara. Exactly what you wanted. But you’ll need good posture with that train, mind.” Leave it to Aunt Carol to bring me back to earth.
I didn't try it on. It wasn’t my size, and I wanted the first true fitting to be *the* moment. But just seeing it, imagining myself in it, was enough. It sparked a fresh wave of excitement, but also a tiny tremor of anxiety. This isn’t just a dress; it’s *the* dress. The one I’ll wear to step into a new chapter, to promise forever to the man I love. It’s a lot of symbolism hanging on a few yards of silk and lace.
Later, over a celebratory, albeit slightly overpriced, coffee, Mom started detailing the seating plan for the reception – again. We’ve been over it a dozen times, but she loves the meticulous planning, the puzzle of placing distant relatives and childhood friends in harmonious proximity. I mostly just nodded, my mind still replaying the image of the dress. Aunt Carol, meanwhile, was sketching out ideas for centerpieces in her notebook, occasionally looking up to ask Mom about flower availability. It's a wonderful chaos, this family of mine. They bring so much warmth and energy, even when it sometimes feels overwhelming.
As I drove home, the city lights blurred around me, and a quiet sense of contentment settled over me. Seeing the dress was like a soft embrace from the future. It affirmed that this is really happening, that all the planning and stress are leading to something truly beautiful. And for tonight, that’s enough. Just the whisper of white, a promise of what’s to come.","Tonight, the diarist finally saw a sample of her wedding dress, a moment shared with her excited mother and aunt that transformed a distant dream into a tangible reality. This experience sparked both deep joy and a slight tremor of anxiety about the significant symbolism of the gown.",1.23456e-05,1.2345e-06,0.0123456789,0.8912345678,0.0854321098,0.0001234567,1.234e-07
"November 28th
I am officially drowning in paper. Or rather, in PDFs of potential menu options, excel sheets of RSVPs, and a sprawling, ever-growing guest list that feels less like a celebration of love and more like a diplomatic summit. Tonight was supposed to be a quiet evening of addressing invitations, but it devolved, as most wedding-related tasks seem to do, into a full-blown family council.
The flashpoint, as always, was Aunt Mildred. My mother insists she *must* be invited. “She’s family, Clara! She’d be terribly offended if she wasn’t there.” My father, bless his pragmatic heart, points out that Aunt Mildred hasn’t left her house in five years, lives three states away, and would likely be miserable at a noisy gathering. “It’s a courtesy invite, honey,” he’d say, trying to mediate. “Just for appearances.”
My fiancé, Tom, who usually maintains a zen-like calm amidst the wedding storm, finally chimed in, “Look, if she’s not going to come, why are we paying for a plate for her? We’re already cutting people from our own lists just to fit everyone.” And that, of course, opened the floodgates.
“But what about cousin Kevin? He’s practically a brother to Tom!” Mom would exclaim, referencing Tom’s second cousin whom I’ve met twice.
“And Uncle Bob,” Dad would add, “he always brings his famous potato salad to family events, it would be rude not to include him.” (We’re having caterers, Dad, but I didn’t have the heart to say it).
It’s not just the numbers; it’s the expectations. Every person on that list represents a connection, a history, a potential obligation. I love my family, truly, deeply, but sometimes their love expresses itself in ways that feel like a vice-grip. They mean well, of course. They want everyone to feel included, to share in our joy. But our ""joy"" is starting to feel like a very expensive, meticulously choreographed performance for an ever-expanding audience.
Tom and I eventually retreated to the kitchen, seeking refuge and a much-needed glass of wine. We just looked at each other, a shared exhaustion etched on our faces. ""So,"" he started, a wry smile playing on his lips, ""Aunt Mildred, then?"" I sighed, a long, drawn-out sound. ""I guess so. It’s easier than the alternative."" We’re picking our battles, and this one, it seems, isn’t worth the fight. Sometimes, you just have to yield to the inevitable family quirks.
We spent another hour just going through our own friends, the people *we* genuinely want there. It felt like a cleansing ritual after the guest list purgatory. There’s Sarah from college, who saw me through my awkward phase. Mark and Lisa, our couple friends who host the best board game nights. Emily, my maid of honor, who has been a rock through all of this. These are the people who have been there, who will continue to be there. And thinking about them, the real meaning of the day came back into focus. It’s about celebrating with the people who love us, and whom we love fiercely.
The quiet moments with Tom are becoming increasingly precious amidst the wedding maelstrom. Just sitting, side by side, addressing envelopes, sharing a chuckle over a particularly unusual address, or just simply holding hands under the table. These are the grounding points, the reminders that amidst all the fuss and the family debates, the core of this whole thing is us. Two people deciding to build a life together.
As I finally sealed the last invitation for the night (addressed to a theoretical Aunt Mildred), I felt a strange mix of exasperation and affection. This process, as chaotic as it is, is binding us all together, in a way. Even Aunt Mildred, from her distant armchair, is contributing to the grand tapestry of our wedding journey. Now, if only someone would remind me where I put the stamps…","The day devolved into a chaotic family debate over the wedding guest list, particularly Aunt Mildred's invitation, leaving the couple feeling overwhelmed.
However, they found solace and renewed focus on their own close friends and their cherished bond, embracing the quiet moments together amidst the wedding planning maelstrom.",0.1498765432,0.0023456789,0.0019876543,0.5534567891,0.0401234567,0.2512345678,0.0009753123
"January 15th
Today was the first proper dress fitting. The one where I actually put *it* on, the one that’s been ordered to my measurements. I woke up with a nervous flutter, a mix of childlike excitement and a very adult apprehension. What if it didn’t feel right? What if it looked different on me than it did in my imagination?
Mom and Emily, my maid of honor, were there. Emily, ever practical, had a small bag of emergency supplies: water, snacks, and a surprisingly large amount of safety pins. Mom, of course, arrived with her camera, already planning angles and lighting. Their excitement was palpable, almost contagious.
Stepping into that beautiful, ornate fitting room felt significant. Sarah, the consultant, greeted us with her usual calm smile. And then, there it was, my dress, hanging like a dream on a mannequin. It was even more stunning than I remembered. The ivory lace, the delicate beading, the elegant train – it was all there, just as I’d envisioned.
The process of putting it on was… an experience. It’s not like slipping into a sundress. There’s structure, boning, and a surprising amount of internal architecture. Sarah helped me navigate the layers of silk and tulle. And then, I was in it.
I walked out of the dressing room, slowly, almost reverently, towards the three-way mirror. And for a moment, just a fleeting moment, I felt like a stranger. It was beautiful, undeniably so, but it was also… a lot. The train felt incredibly long, the bodice surprisingly snug, and the sheer volume of fabric was a revelation. I looked at my reflection, and then at Mom and Emily’s beaming faces. “Oh, Clara!” Mom exclaimed, tears already welling. “You look absolutely breathtaking!” Emily just smiled, a soft, approving look.
I tried to smile back, to mirror their joy, but a tiny seed of doubt had sprouted. It wasn’t that the dress was wrong, not exactly. It was more that the *image* of the bride, the perfect, ethereal being I’d imagined, felt so separate from the very real, slightly overwhelmed woman standing in front of the mirror. This was me, yes, but it was also a much grander, more formal version of me.
Sarah, sensing my slight hesitation, asked gently, “How does it feel, Clara?” I paused. “It’s… beautiful,” I said, trying to infuse my voice with conviction. “It’s just… a lot of dress.”
She nodded, understanding. “It’s a ballgown, darling. It’s meant to make a statement. We’ll work on the bustle to make it easier to move in, and we can adjust the straps for comfort. It’s still very early in the fitting process.” She then held up a veil. A long, delicate veil, edged with the same lace as the dress.
When she placed it on my head, suddenly, it clicked. The veil, with its ethereal softness, softened the grandeur of the dress. It framed my face, made the whole look cohesive. It wasn’t just a dress anymore; it was *the* bridal look. And as I looked at my reflection with the veil on, a tear finally escaped my eye. Not of sadness, but of a profound, quiet understanding. This wasn’t just about a dress. It was about stepping into a role, embracing a new identity, and the weight of that beautiful, joyful commitment.
Mom and Emily were practically vibrating with excitement. Emily was already envisioning hairstyles, and Mom was asking about shoe options. They were so happy, so supportive. And their joy, in turn, helped me to embrace the moment.
Leaving the boutique, I felt a shift. The initial apprehension had melted away, replaced by a quiet excitement. The dress is beautiful. It’s grand. And it’s mine. But more importantly, it’s a symbol of the immense love and support surrounding me, and the exciting journey that lies ahead. The reality of being a bride is a little different from the fantasy, but in many ways, it’s far more profound.","A highly anticipated wedding dress fitting began with nervous excitement, leading to a momentary feeling of overwhelm as the gown's grandeur was realized. However, the addition of a veil brought a profound understanding and acceptance, transforming initial apprehension into quiet excitement and a deep appreciation for the journey ahead.",0.0,0.0,0.0409507179,0.6974589167,0.125963401,0.03,0.0821084223
"February 28th
I spent most of the day today trying to get paint samples for the spare room (which is quickly becoming the “future nursery” in everyone’s mind, despite us agreeing to take things one step at a time). But my mind kept drifting to Tom. He’s on his bachelor party trip this weekend. And frankly, I’m a mess.
It’s not that I don’t trust him. I do, implicitly. Tom is one of the most stand-up, loyal men I know. It’s not that I begrudge him a good time with his friends. He deserves it, after putting up with my wedding-induced neuroses for months. No, it’s… something else entirely. It’s the feeling of being left behind, of a chapter closing, of the unknown.
His texts have been sparse, as expected. A blurry photo of them at a bar. A quick “Having fun, miss you.” Which, of course, just makes me miss him more. My imagination, always prone to exaggeration, has been working overtime. Are they doing ridiculous things? Are they laughing at my expense? Are they having *too much* fun without me? It’s completely irrational, I know. It’s just… a weird pre-wedding anxiety manifesting itself.
I called Emily this afternoon, almost rambling with my anxieties. She listened patiently, as she always does, then finally said, “Clara, honey, breathe. He’s allowed to have a last hurrah. It doesn’t diminish what you two have. If anything, it’ll make him appreciate coming home to you even more.” She then reminded me of *my* bachelorette party, the one where we ended up singing karaoke at a dive bar until 2 AM and I almost lost my voice. “Remember how much fun *you* had? He’s probably just having his version of that. And trust me, by Sunday, he’ll be ready to come home and hibernate.”
Her words, as always, were a much-needed dose of reality and perspective. My anxieties are not about Tom; they’re about this huge, impending change. It’s like standing on the edge of a cliff, knowing you’re about to jump into something incredible, but still feeling that primal fear of the unknown. The bachelor party is just a tangible manifestation of that. It’s the last taste of “single life” for him, and by extension, for me. And while I’m beyond excited to be a “Mrs.,” there’s a small, quiet part of me that’s mourning the easy, carefree days of just “me.”
Later, I Facetimed my parents. Dad was watching some obscure sports game, and Mom was knitting. They looked so calm, so settled in their routine. I just watched them for a few minutes, soaking in their quiet normalcy. “Everything alright, sweetie?” Mom asked, looking up from her needles. “Yeah, Mom,” I said, a little too quickly. “Just missing Tom.” She smiled knowingly. “He’ll be back soon. And then you’ll be stuck with him for life!” she teased, and Dad chuckled.
It sounds so cliché, but seeing them, two people who have built a life together, through thick and thin, for over 35 years, brought a surprising comfort. Their marriage isn't a Hollywood romance; it's a tapestry woven with shared jokes, quiet understanding, compromise, and a deep, enduring love. It’s real. And that’s what I want with Tom. Not a fairytale, but a life.
As I climbed into bed tonight, the house felt a little too quiet without Tom. But the feeling of anxious dread had subsided, replaced by a quiet longing for his return. Not for him to complete me, but for him to share this journey with me. This rollercoaster of joy and stress, of family chaos and quiet moments. We’re in this together. And even a weekend apart, full of paint samples and bachelor party shenanigans, is just a small blip in the grand adventure we’re about to embark on.","Clara spent her day battling pre-wedding anxiety over her fiancé Tom's bachelor party, initially feeling left behind and fearful of the unknown. Through conversations with her friend Emily and her parents, she found comfort and perspective, shifting her focus to a quiet anticipation of their shared future together.",0.0003456789,0.0002876543,0.1012345678,0.4578912345,0.2567891234,0.153456789,0.03
"March 10th
It’s less than two weeks now. Two weeks until I walk down that aisle, until I say “I do,” until I officially become Mrs. Thompson. The house is a whirlwind of last-minute details. Boxes of wedding favors stacked in the living room, a mountain of programs needing assembly, and my final fitting for the dress is tomorrow. The energy in the air is palpable, a mix of frantic excitement and a strange, almost serene calm.
Tonight, after a particularly intense session of trying to finalize the playlist for the reception (why is it so hard to choose between two versions of the same song?!), I found myself staring out the kitchen window. It was raining softly, a gentle patter against the glass, and the streetlights cast a warm, hazy glow on the wet pavement. For a moment, the wedding planning, the guest lists, the dress, the flowers – it all faded into the background.
I thought about the past few months. The late nights, the occasional disagreements with Mom (mostly about the size of the floral arrangements), the endless decisions. It's been a marathon, emotionally and physically. There were moments of genuine despair, where I just wanted to elope to a distant island with Tom and forget the whole thing. But then there were moments of pure, unadulterated joy. The first time I saw Tom’s face light up when he saw the venue. The way my bridesmaids rallied around me, offering support and laughter. The quiet understanding glances exchanged with Tom when we were both overwhelmed.
My little sister, Sarah, came over earlier to help me with the programs. She’s only 16, and she was full of questions about the whole process. “Is it scary, Clara? Like, getting married and everything?” I paused, folding a program carefully. “A little,” I admitted. “It’s a big step. But mostly, it’s exciting. It’s like stepping into a whole new adventure.” She nodded, looking thoughtful. Her youthful earnestness reminded me of how significant this truly is, beyond the pretty details and the party.
Later, I FaceTimed Tom. He was at his parents’ house, helping his dad with some last-minute repairs to the pergola that will be used for the ceremony. He looked tired but happy. We talked about nothing and everything for a while – the weather forecast, a funny thing his dog did, the ridiculousness of ordering custom cocktail napkins. And then, he just looked at me through the screen, his eyes soft. “Are you ready?” he asked.
And in that moment, looking at his kind, familiar face, the face of the man who knows me better than anyone, who accepts me with all my quirks and anxieties, a profound sense of peace washed over me. “Yes,” I said, and this time, there was no hesitation, no underlying worry. “I’m ready.”
The quiet after our call settled over me like a comforting blanket. The rain outside continued its gentle rhythm. The house was finally still. And for the first time in what felt like forever, I wasn’t thinking about what still needed to be done, or what might go wrong. I was just feeling. Feeling the anticipation, the love, the immense privilege of standing on the precipice of something so beautiful.
This journey has been a rollercoaster, a mix of stress and elation. But through it all, it has cemented my understanding of what truly matters: the love I share with Tom, the unwavering support of my family and friends, and the exciting prospect of a future built together. The dress, the flowers, the food – they’re just the trimmings. The real magic is in the promise, the commitment, and the quiet, unwavering joy of knowing I’m about to marry my best friend. The storm of planning is almost over. And the joy, I can feel it, is just beginning.","Amidst a whirlwind of last-minute wedding preparations, the narrator reflects on the emotional journey, ultimately finding profound peace and readiness for marriage after a heartfelt conversation with her fiancé, Tom.",0.0098765432,0.0023456789,0.0156789123,0.7056789123,0.1851234567,0.0754321098,0.0058765432
"July 3rd
Dear Diary,
Oh my god, I still can’t believe it’s only the beginning of July. This summer is already shaping up to be epic. Mom and Dad finally, *finally* decided to just let me be. No curfews, well, not strict ones anyway. Just “be home before the sun comes up, kiddo,” which is practically an invitation to stay out all night. Liam and Chloe are in the same boat, their parents are apparently enjoying their newfound freedom from nagging us as much as we are enjoying ours.
Yesterday was a blur of pure, unadulterated sunshine. We woke up late, of course, stumbling out of bed around eleven. The air was already thick with that summer hum – the cicadas singing, the distant drone of someone’s lawnmower, the faint smell of chlorine from the community pool. We grabbed our bikes, not even bothering with breakfast, just swigging some lukewarm juice boxes we found in the fridge. Our destination? The old abandoned quarry. It’s a bit of a trek, maybe five miles each way, mostly uphill through dusty back roads. My legs were burning by the time we got there, but the feeling of the wind whipping past my face on the downhill stretches was worth every bead of sweat.
The quarry is our secret haven. The water is impossibly clear, a deep, cool emerald green, and even though there are signs everywhere warning against swimming, we always do. It’s a risk, but that’s half the fun, isn't it? The sheer thrill of knowing you’re doing something a little bit illicit, a little bit dangerous. We stripped down to our swimsuits and cannonballed in, the cold shock making us gasp and shiver before the warmth of the sun on our skin brought us back. We spent hours just floating, laughing, and trying to splash each other without getting caught. Liam, being the daredevil, kept climbing up the jagged rocks overlooking the water and doing increasingly elaborate dives – mostly belly flops, but he sold them with such conviction. Chloe and I just lay on our backs, watching the clouds drift by, talking about everything and nothing. College plans, who we secretly have crushes on, how much we hate having to go back to school in September.
As the sun started to dip low, painting the sky in fiery oranges and purples, we reluctantly started our ride back. My calves were aching, but it was a good ache, the kind that reminds you you’ve *lived* that day. We stopped at the gas station for Slurpees and gummy worms – our traditional post-quarry treat. There was a moment when we were just sitting on the curb outside, sticky and tired, watching the last sliver of sun disappear, and I felt this overwhelming surge of happiness. Like, this is it. This is what summer is for. No schedules, no homework, just good friends and endless days. I can’t wait to see what tomorrow brings. Maybe another bike ride, maybe the lake. The possibilities feel endless.",A perfect summer day unfolds as the narrator and friends bike to a secret abandoned quarry for an afternoon of illicit swimming and daring jumps. The day concludes with a sweet treat and an overwhelming feeling of happiness and boundless possibility.,0.0004321,0.0004321,0.00123456,0.9554321,0.02987654,0.00901234,0.00356789
